<?xml version="1.0" encoding="UTF-8"?>
<appointmentSystem 
    xmlns="https://www.saglikrandevu.com/schema"
    xmlns:xsi="http://www.w3.org/2001/XMLSchema-instance"
    xsi:schemaLocation="https://www.saglikrandevu.com/schema healthcare.xsd">

    <!-- 1. KLİNİKLER VE DOKTORLAR (TAM 5 DOKTOR) -->
    <clinics>
        <clinic>
            <clinicId>C01</clinicId>
            <clinicName>Kardiyoloji</clinicName>
            <doctors>
                <doctor>
                    <doctorId>D01</doctorId>
                    <firstName>Ahmet</firstName>
                    <lastName>Yilmaz</lastName>
                    <email>ahmet.yilmaz@hastane.com</email>
                </doctor>
                <doctor>
                    <doctorId>D02</doctorId>
                    <firstName>Elif</firstName>
                    <lastName>Kaya</lastName>
                    <email>elif.kaya@hastane.com</email>
                </doctor>
            </doctors>
        </clinic>
        <clinic>
            <clinicId>C02</clinicId>
            <clinicName>Goz Hastaliklari</clinicName>
            <doctors>
                <doctor>
                    <doctorId>D03</doctorId>
                    <firstName>Can</firstName>
                    <lastName>Demir</lastName>
                    <email>can.demir@hastane.com</email>
                </doctor>
                <doctor>
                    <doctorId>D04</doctorId>
                    <firstName>Zeynep</firstName>
                    <lastName>Sahin</lastName>
                    <email>zeynep.sahin@hastane.com</email>
                </doctor>
            </doctors>
        </clinic>
        <clinic>
            <clinicId>C03</clinicId>
            <clinicName>Cocuk Sagligi</clinicName>
            <doctors>
                <doctor>
                    <doctorId>D05</doctorId>
                    <firstName>Murat</firstName>
                    <lastName>Celik</lastName>
                    <email>murat.celik@hastane.com</email>
                </doctor>
            </doctors>
        </clinic>
    </clinics>

    <!-- 2. HASTALAR (TAM 15 HASTA) -->
    <patients>
        <patient>
            <patientId>P01</patientId>
            <firstName>Ayse</firstName>
            <lastName>Ozturk</lastName>
            <phone>+90-555-123-4567</phone>
            <email>ayse.ozturk@email.com</email>
            <dateOfBirth>1990-05-15</dateOfBirth>
        </patient>
        <patient>
            <patientId>P02</patientId>
            <firstName>Mehmet</firstName>
            <lastName>Yildiz</lastName>
            <phone>+90-532-987-6543</phone>
            <email>mehmet.yildiz@email.com</email>
            <dateOfBirth>1985-11-20</dateOfBirth>
        </patient>
        <patient>
            <patientId>P03</patientId>
            <firstName>Fatma</firstName>
            <lastName>Demir</lastName>
            <phone>+90-544-333-2211</phone>
            <email>fatma.demir@email.com</email>
            <dateOfBirth>1978-03-08</dateOfBirth>
        </patient>
        <patient>
            <patientId>P04</patientId>
            <firstName>Ali</firstName>
            <lastName>Can</lastName>
            <phone>+90-505-444-5566</phone>
            <email>ali.can@email.com</email>
            <dateOfBirth>1995-09-30</dateOfBirth>
        </patient>
        <patient>
            <patientId>P05</patientId>
            <firstName>Zeynep</firstName>
            <lastName>Kaya</lastName>
            <phone>+90-533-555-4433</phone>
            <email>zeynep.kaya@email.com</email>
            <dateOfBirth>2002-01-12</dateOfBirth>
        </patient>
        <patient>
            <patientId>P06</patientId>
            <firstName>Mustafa</firstName>
            <lastName>Ozturk</lastName>
            <phone>+90-542-666-7788</phone>
            <email>mustafa.ozturk@email.com</email>
            <dateOfBirth>1965-07-25</dateOfBirth>
        </patient>
        <patient>
            <patientId>P07</patientId>
            <firstName>Elif</firstName>
            <lastName>Sahin</lastName>
            <phone>+90-553-777-8899</phone>
            <email>elif.sahin@email.com</email>
            <dateOfBirth>2010-10-05</dateOfBirth>
        </patient>
        <patient>
            <patientId>P08</patientId>
            <firstName>Omer</firstName>
            <lastName>Faruk</lastName>
            <phone>+90-541-888-9900</phone>
            <email>omer.faruk@email.com</email>
            <dateOfBirth>1992-12-18</dateOfBirth>
        </patient>
        <patient>
            <patientId>P09</patientId>
            <firstName>Yasemin</firstName>
            <lastName>Bulut</lastName>
            <phone>+90-536-111-2233</phone>
            <email>yasemin.bulut@email.com</email>
            <dateOfBirth>1988-04-22</dateOfBirth>
        </patient>
        <patient>
            <patientId>P10</patientId>
            <firstName>Burak</firstName>
            <lastName>Yilmaz</lastName>
            <phone>+90-507-222-3344</phone>
            <email>burak.yilmaz@email.com</email>
            <dateOfBirth>2015-08-14</dateOfBirth>
        </patient>
        <patient>
            <patientId>P11</patientId>
            <firstName>Selin</firstName>
            <lastName>Arslan</lastName>
            <phone>+90-535-444-1122</phone>
            <email>selin.arslan@email.com</email>
            <dateOfBirth>1994-02-28</dateOfBirth>
        </patient>
        <patient>
            <patientId>P12</patientId>
            <firstName>Hakan</firstName>
            <lastName>Koc</lastName>
            <phone>+90-543-555-8811</phone>
            <email>hakan.koc@email.com</email>
            <dateOfBirth>1981-06-12</dateOfBirth>
        </patient>
        <patient>
            <patientId>P13</patientId>
            <firstName>Merve</firstName>
            <lastName>Aydin</lastName>
            <phone>+90-506-777-2233</phone>
            <email>merve.aydin@email.com</email>
            <dateOfBirth>1989-10-10</dateOfBirth>
        </patient>
        <patient>
            <patientId>P14</patientId>
            <firstName>Gokhan</firstName>
            <lastName>Tekin</lastName>
            <phone>+90-539-888-3344</phone>
            <email>gokhan.tekin@email.com</email>
            <dateOfBirth>1975-04-03</dateOfBirth>
        </patient>
        <patient>
            <patientId>P15</patientId>
            <firstName>Busra</firstName>
            <lastName>Ozel</lastName>
            <phone>+90-552-999-4455</phone>
            <email>busra.ozel@email.com</email>
            <dateOfBirth>1997-12-25</dateOfBirth>
        </patient>
    </patients>

    <!-- 3. RANDEVULAR (TAM 25 RANDEVU) -->
    <appointments>
        <appointment>
            <appointmentId>A01</appointmentId>
            <doctorId>D01</doctorId>
            <patientId>P01</patientId>
            <appointmentDateTime>2026-06-01T09:00:00</appointmentDateTime>
            <status>Pending</status>
            <notes>Rutin kardiyoloji kontrolu.</notes>
        </appointment>
        <appointment>
            <appointmentId>A02</appointmentId>
            <doctorId>D03</doctorId>
            <patientId>P02</patientId>
            <appointmentDateTime>2026-06-01T10:30:00</appointmentDateTime>
            <status>Completed</status>
            <notes>Goz muayenesi ve gozluk recetesi.</notes>
        </appointment>
        <appointment>
            <appointmentId>A03</appointmentId>
            <doctorId>D05</doctorId>
            <patientId>P07</patientId>
            <appointmentDateTime>2026-06-01T11:00:00</appointmentDateTime>
            <status>Completed</status>
            <notes>Cocuk sagligi rutin gelisim takibi.</notes>
        </appointment>
        <appointment>
            <appointmentId>A04</appointmentId>
            <doctorId>D01</doctorId>
            <patientId>P03</patientId>
            <appointmentDateTime>2026-06-01T14:00:00</appointmentDateTime>
            <status>Cancelled</status>
            <notes>Hasta randevuya gelemeyecegini bildirdi.</notes>
        </appointment>
        <appointment>
            <appointmentId>A05</appointmentId>
            <doctorId>D02</doctorId>
            <patientId>P04</patientId>
            <appointmentDateTime>2026-06-02T09:30:00</appointmentDateTime>
            <status>Pending</status>
            <notes>Efor testi sonucu degerlendirmesi.</notes>
        </appointment>
        <appointment>
            <appointmentId>A06</appointmentId>
            <doctorId>D04</doctorId>
            <patientId>P05</patientId>
            <appointmentDateTime>2026-06-02T11:30:00</appointmentDateTime>
            <status>Pending</status>
            <notes>Lazer operasyonu sonrasi ilk kontrol.</notes>
        </appointment>
        <appointment>
            <appointmentId>A07</appointmentId>
            <doctorId>D05</doctorId>
            <patientId>P10</patientId>
            <appointmentDateTime>2026-06-02T13:30:00</appointmentDateTime>
            <status>Pending</status>
            <notes>Asi takvimi takibi.</notes>
        </appointment>
        <appointment>
            <appointmentId>A08</appointmentId>
            <doctorId>D01</doctorId>
            <patientId>P06</patientId>
            <appointmentDateTime>2026-06-03T10:00:00</appointmentDateTime>
            <status>Pending</status>
            <notes>Tansiyon takibi ve ilac doz ayari.</notes>
        </appointment>
        <appointment>
            <appointmentId>A09</appointmentId>
            <doctorId>D02</doctorId>
            <patientId>P08</patientId>
            <appointmentDateTime>2026-06-03T15:00:00</appointmentDateTime>
            <status>Completed</status>
            <notes>Kardiyak rontgen kontrolu.</notes>
        </appointment>
        <appointment>
            <appointmentId>A10</appointmentId>
            <doctorId>D03</doctorId>
            <patientId>P09</patientId>
            <appointmentDateTime>2026-06-04T09:15:00</appointmentDateTime>